{
  "allocations": {
    "DEC-0001": "urn:uuid:01a037f5-a629-7026-8df2-78faaa6b73c2",
    "DEC-0002": "urn:uuid:01a037f5-a7ed-7ca5-9663-152268a2b2b9",
    "GATE-0001": "urn:uuid:01a037f5-a948-77a1-9c67-52962383f7d1",
    "GATE-0002": "urn:uuid:01a03cca-930f-702f-82f2-839d4407eac6",
    "WI-0001": "urn:uuid:01a0336d-2234-718d-9ab8-51e5c723aa31",
    "WI-0002": "urn:uuid:01a037f5-a4f5-7706-8f1e-1280f69f231b",
    "WI-0003": "urn:uuid:01a037f5-a719-756c-80b8-a902c4e3877d",
    "WI-0004": "urn:uuid:01a037f5-aa10-748a-9f8f-401b9f442490"
  },
  "prefixes": {
    "CAP": {
      "kind": "capability",
      "next_sequence": 1,
      "width": 4
    },
    "DEC": {
      "kind": "decision",
      "next_sequence": 3,
      "width": 4
    },
    "EXP": {
      "kind": "experiment",
      "next_sequence": 1,
      "width": 4
    },
    "GATE": {
      "kind": "gate",
      "next_sequence": 3,
      "width": 4
    },
    "INC": {
      "kind": "incident",
      "next_sequence": 1,
      "width": 4
    },
    "OPS": {
      "kind": "operational_work",
      "next_sequence": 1,
      "width": 4
    },
    "REL": {
      "kind": "release",
      "next_sequence": 1,
      "width": 4
    },
    "REQ": {
      "kind": "requirement",
      "next_sequence": 1,
      "width": 4
    },
    "RISK": {
      "kind": "risk",
      "next_sequence": 1,
      "width": 4
    },
    "TEST": {
      "kind": "test",
      "next_sequence": 1,
      "width": 4
    },
    "WI": {
      "kind": "work_item",
      "next_sequence": 5,
      "width": 4
    }
  },
  "profile": "foundation-artifact-registry/v1",
  "registry_revision": 8,
  "schema_version": 1
}
